{
  "sendtTid": "2022-11-03T10:19:55+02:00",
  "meldingsId": "C5E8E429-2B8E-48A9-A9D3-FDAA5F9BE2",
  "rekvisisjonsId": "0322B3E2-B12B-40B6-8940-799C48706123",
  "person": {
    "identitet": {
      "idType": "FOEDSELSNUMMER",
      "verdi": "14846399381"
    }
  },
  "enhet": "8410",
  "saksId": "...",
  "fengsletSiden": "2022-11-03",
  "proeveTatt": "2022-11-03T10:19:55+02:00",
  "medikamenter": [
    {
      "preparat": "...",
      "dose": "...",
      "sistTatt": "2022-11-03T10:19:55+02:00"
    }
  ],
  "proeveType": "URIN",
  "andreStofferForAnalyse": "..."
}
